{
  "cycle": "080",
  "agent": "A",
  "agent_lane": "PM planning, architecture, docs, GitHub governance, config",
  "agentlane": "PM planning, architecture, docs, GitHub governance, config",
  "branch": "cycle/080/integration",
  "model_policy": {
    "worker": "Cursor CLI",
    "model": "codex-5.3",
    "effort": "medium",
    "auto": false,
    "fallback": false
  },
  "modelpolicy": {
    "worker": "Cursor CLI",
    "model": "codex-5.3",
    "effort": "medium",
    "auto": false,
    "fallback": false,
    "auto_model_selection": "DISABLED"
  },
  "jira_scope": [
    {
      "key": "SCRUM-263",
      "summary": "Cycle 079 planning and PM Pack integration governance",
      "status": "To Do",
      "priority": "High",
      "acceptance_criteria": [
        "Cycle planning artifacts are refreshed for 079",
        "Cross-agent dependencies are reflected in PM docs"
      ],
      "definition_of_done": [
        "Governance docs updated and internally consistent",
        "Cycle report includes AGENT_COMPLETE evidence"
      ],
      "project_plan_path": "PM_Pack/ref/project_plan/13_Cycle_013_Execution_Protocol.md",
      "files_or_modules": [
        "PM_Pack/**",
        "docs/cycle_reports/CYCLE_079_AGENT_A.md"
      ],
      "acceptancecriteria": [
        "Cycle planning artifacts are refreshed for 079",
        "Cross-agent dependencies are reflected in PM docs"
      ],
      "definitionofdone": [
        "Governance docs updated and internally consistent",
        "Cycle report includes AGENT_COMPLETE evidence"
      ],
      "projectplanpath": "PM_Pack/ref/project_plan/13_Cycle_013_Execution_Protocol.md",
      "filesormodules": [
        "PM_Pack/**",
        "docs/cycle_reports/CYCLE_079_AGENT_A.md"
      ]
    }
  ],
  "jirascope": [
    {
      "key": "SCRUM-263",
      "summary": "Cycle 079 planning and PM Pack integration governance",
      "status": "To Do",
      "priority": "High",
      "acceptance_criteria": [
        "Cycle planning artifacts are refreshed for 079",
        "Cross-agent dependencies are reflected in PM docs"
      ],
      "definition_of_done": [
        "Governance docs updated and internally consistent",
        "Cycle report includes AGENT_COMPLETE evidence"
      ],
      "project_plan_path": "PM_Pack/ref/project_plan/13_Cycle_013_Execution_Protocol.md",
      "files_or_modules": [
        "PM_Pack/**",
        "docs/cycle_reports/CYCLE_079_AGENT_A.md"
      ],
      "acceptancecriteria": [
        "Cycle planning artifacts are refreshed for 079",
        "Cross-agent dependencies are reflected in PM docs"
      ],
      "definitionofdone": [
        "Governance docs updated and internally consistent",
        "Cycle report includes AGENT_COMPLETE evidence"
      ],
      "projectplanpath": "PM_Pack/ref/project_plan/13_Cycle_013_Execution_Protocol.md",
      "filesormodules": [
        "PM_Pack/**",
        "docs/cycle_reports/CYCLE_079_AGENT_A.md"
      ]
    }
  ],
  "allowed_paths": [
    "PM_Pack/**",
    "docs/**",
    ".github/**",
    "pyproject.toml",
    "config.yaml",
    ".cursorrules"
  ],
  "allowedpaths": [
    "PM_Pack/**",
    "docs/**",
    ".github/**",
    "pyproject.toml",
    "config.yaml",
    ".cursorrules"
  ],
  "blocked_paths": [
    "src/**",
    "tests/**",
    "data/**"
  ],
  "blockedpaths": [
    "src/**",
    "tests/**",
    "data/**"
  ],
  "validation_commands": [
    "python automation/ai_cycle_controller.py brain-check",
    "python automation/ai_cycle_controller.py validate-prompts --cycle 080"
  ],
  "validationcommands": [
    "python automation/ai_cycle_controller.py brain-check",
    "python automation/ai_cycle_controller.py validate-prompts --cycle 080"
  ],
  "final_report_path": "docs/cycle_reports/CYCLE_080_AGENT_A.md",
  "finalreportpath": "docs/cycle_reports/CYCLE_080_AGENT_A.md",
  "built_at": "2026-06-15T15:40:19.505770+00:00",
  "builtat": "2026-06-15T15:40:19.505770+00:00",
  "contract_version": "1.0.0",
  "contractversion": "1.0.0",
  "metadata": {
    "sources_used": [
      "PM_Pack/automation/project_plan_catalog.json",
      "PM_Pack/automation/dod_catalog.json",
      "PM_Pack/automation/todo_epic_catalog.json",
      "PM_Pack/automation/github_governance_catalog.json",
      "PM_Pack/automation/agent_lanes.yml",
      "SCRUM-263"
    ],
    "sourcesused": [
      "PM_Pack/automation/project_plan_catalog.json",
      "PM_Pack/automation/dod_catalog.json",
      "PM_Pack/automation/todo_epic_catalog.json",
      "PM_Pack/automation/github_governance_catalog.json",
      "PM_Pack/automation/agent_lanes.yml",
      "SCRUM-263"
    ],
    "catalog_counts": {
      "project_plan": 96,
      "dod": 10,
      "todo": 11,
      "github": 47
    }
  }
}
