{
  "cycle": "081",
  "agent": "A",
  "agent_lane": "PM planning, architecture, docs, GitHub governance, config",
  "agentlane": "PM planning, architecture, docs, GitHub governance, config",
  "branch": "cycle/081/integration",
  "model_policy": {
    "worker": "Cursor CLI",
    "model": "codex-5.3",
    "effort": "medium",
    "auto": false,
    "fallback": false
  },
  "modelpolicy": {
    "worker": "Cursor CLI",
    "model": "codex-5.3",
    "effort": "medium",
    "auto": false,
    "fallback": false,
    "auto_model_selection": "DISABLED"
  },
  "jira_scope": [
    {
      "key": "SCRUM-1039",
      "summary": "State advance + Stage 2 readiness",
      "status": "To Do",
      "priority": "High",
      "acceptance_criteria": [
        "Cycle state advanced and validated",
        "Stage 2 readiness artifacts captured"
      ],
      "definition_of_done": [
        "Brain-check and pm-pack-audit pass",
        "Cycle report documents readiness"
      ],
      "project_plan_path": "PM_Pack/ref/project_plan/13_Cycle_013_Execution_Protocol.md",
      "files_or_modules": [
        "PM_Pack/**",
        "docs/**"
      ],
      "acceptancecriteria": [
        "Cycle state advanced and validated",
        "Stage 2 readiness artifacts captured"
      ],
      "definitionofdone": [
        "Brain-check and pm-pack-audit pass",
        "Cycle report documents readiness"
      ],
      "projectplanpath": "PM_Pack/ref/project_plan/13_Cycle_013_Execution_Protocol.md",
      "filesormodules": [
        "PM_Pack/**",
        "docs/**"
      ]
    },
    {
      "key": "SCRUM-1040",
      "summary": "Advisory-confirm mode enforcement",
      "status": "To Do",
      "priority": "High",
      "acceptance_criteria": [
        "Advisory-confirm mode enabled and verified",
        "Routing policy evidence captured"
      ],
      "definition_of_done": [
        "Provider routing validations pass",
        "Policy/config artifacts updated"
      ],
      "project_plan_path": "PM_Pack/ref/project_plan/13_Cycle_013_Execution_Protocol.md",
      "files_or_modules": [
        "automation/**",
        "PM_Pack/**"
      ],
      "acceptancecriteria": [
        "Advisory-confirm mode enabled and verified",
        "Routing policy evidence captured"
      ],
      "definitionofdone": [
        "Provider routing validations pass",
        "Policy/config artifacts updated"
      ],
      "projectplanpath": "PM_Pack/ref/project_plan/13_Cycle_013_Execution_Protocol.md",
      "filesormodules": [
        "automation/**",
        "PM_Pack/**"
      ]
    }
  ],
  "jirascope": [
    {
      "key": "SCRUM-1039",
      "summary": "State advance + Stage 2 readiness",
      "status": "To Do",
      "priority": "High",
      "acceptance_criteria": [
        "Cycle state advanced and validated",
        "Stage 2 readiness artifacts captured"
      ],
      "definition_of_done": [
        "Brain-check and pm-pack-audit pass",
        "Cycle report documents readiness"
      ],
      "project_plan_path": "PM_Pack/ref/project_plan/13_Cycle_013_Execution_Protocol.md",
      "files_or_modules": [
        "PM_Pack/**",
        "docs/**"
      ],
      "acceptancecriteria": [
        "Cycle state advanced and validated",
        "Stage 2 readiness artifacts captured"
      ],
      "definitionofdone": [
        "Brain-check and pm-pack-audit pass",
        "Cycle report documents readiness"
      ],
      "projectplanpath": "PM_Pack/ref/project_plan/13_Cycle_013_Execution_Protocol.md",
      "filesormodules": [
        "PM_Pack/**",
        "docs/**"
      ]
    },
    {
      "key": "SCRUM-1040",
      "summary": "Advisory-confirm mode enforcement",
      "status": "To Do",
      "priority": "High",
      "acceptance_criteria": [
        "Advisory-confirm mode enabled and verified",
        "Routing policy evidence captured"
      ],
      "definition_of_done": [
        "Provider routing validations pass",
        "Policy/config artifacts updated"
      ],
      "project_plan_path": "PM_Pack/ref/project_plan/13_Cycle_013_Execution_Protocol.md",
      "files_or_modules": [
        "automation/**",
        "PM_Pack/**"
      ],
      "acceptancecriteria": [
        "Advisory-confirm mode enabled and verified",
        "Routing policy evidence captured"
      ],
      "definitionofdone": [
        "Provider routing validations pass",
        "Policy/config artifacts updated"
      ],
      "projectplanpath": "PM_Pack/ref/project_plan/13_Cycle_013_Execution_Protocol.md",
      "filesormodules": [
        "automation/**",
        "PM_Pack/**"
      ]
    }
  ],
  "allowed_paths": [
    "PM_Pack/**",
    "docs/**",
    ".github/**",
    "pyproject.toml",
    "config.yaml",
    ".cursorrules"
  ],
  "allowedpaths": [
    "PM_Pack/**",
    "docs/**",
    ".github/**",
    "pyproject.toml",
    "config.yaml",
    ".cursorrules"
  ],
  "blocked_paths": [
    "src/**",
    "tests/**",
    "data/**"
  ],
  "blockedpaths": [
    "src/**",
    "tests/**",
    "data/**"
  ],
  "validation_commands": [
    "python automation/ai_cycle_controller.py brain-check",
    "python automation/ai_cycle_controller.py validate-prompts --cycle 080"
  ],
  "validationcommands": [
    "python automation/ai_cycle_controller.py brain-check",
    "python automation/ai_cycle_controller.py validate-prompts --cycle 080"
  ],
  "final_report_path": "docs/cycle_reports/CYCLE_081_AGENT_A.md",
  "finalreportpath": "docs/cycle_reports/CYCLE_081_AGENT_A.md",
  "built_at": "2026-06-15T22:22:25.186567+00:00",
  "builtat": "2026-06-15T22:22:25.186567+00:00",
  "contract_version": "1.0.0",
  "contractversion": "1.0.0",
  "metadata": {
    "sources_used": [
      "PM_Pack/automation/project_plan_catalog.json",
      "PM_Pack/automation/dod_catalog.json",
      "PM_Pack/automation/todo_epic_catalog.json",
      "PM_Pack/automation/github_governance_catalog.json",
      "PM_Pack/automation/agent_lanes.yml",
      "SCRUM-263"
    ],
    "sourcesused": [
      "PM_Pack/automation/project_plan_catalog.json",
      "PM_Pack/automation/dod_catalog.json",
      "PM_Pack/automation/todo_epic_catalog.json",
      "PM_Pack/automation/github_governance_catalog.json",
      "PM_Pack/automation/agent_lanes.yml",
      "SCRUM-263"
    ],
    "catalog_counts": {
      "project_plan": 96,
      "dod": 10,
      "todo": 11,
      "github": 47
    }
  }
}
