{
  "cycle": "080",
  "agent": "C",
  "agent_lane": "Integration checks, validation run, cycle report",
  "agentlane": "Integration checks, validation run, cycle report",
  "branch": "cycle/080/integration",
  "model_policy": {
    "worker": "Cursor CLI",
    "model": "codex-5.3",
    "effort": "medium",
    "auto": false,
    "fallback": false
  },
  "modelpolicy": {
    "worker": "Cursor CLI",
    "model": "codex-5.3",
    "effort": "medium",
    "auto": false,
    "fallback": false,
    "auto_model_selection": "DISABLED"
  },
  "jira_scope": [
    {
      "key": "SCRUM-265",
      "summary": "Provider Router integration and adapter orchestration",
      "status": "To Do",
      "priority": "High",
      "acceptance_criteria": [
        "Provider router selects approved providers by task class",
        "Adapter pathways preserve policy and cost guard constraints"
      ],
      "definition_of_done": [
        "Provider routing integration tests pass",
        "Router decisions include auditable rationale"
      ],
      "project_plan_path": "PM_Pack/ref/project_plan/13_Cycle_013_Execution_Protocol.md",
      "files_or_modules": [
        "automation/provider_router.py",
        "automation/adapters/"
      ],
      "acceptancecriteria": [
        "Provider router selects approved providers by task class",
        "Adapter pathways preserve policy and cost guard constraints"
      ],
      "definitionofdone": [
        "Provider routing integration tests pass",
        "Router decisions include auditable rationale"
      ],
      "projectplanpath": "PM_Pack/ref/project_plan/13_Cycle_013_Execution_Protocol.md",
      "filesormodules": [
        "automation/provider_router.py",
        "automation/adapters/"
      ]
    }
  ],
  "jirascope": [
    {
      "key": "SCRUM-265",
      "summary": "Provider Router integration and adapter orchestration",
      "status": "To Do",
      "priority": "High",
      "acceptance_criteria": [
        "Provider router selects approved providers by task class",
        "Adapter pathways preserve policy and cost guard constraints"
      ],
      "definition_of_done": [
        "Provider routing integration tests pass",
        "Router decisions include auditable rationale"
      ],
      "project_plan_path": "PM_Pack/ref/project_plan/13_Cycle_013_Execution_Protocol.md",
      "files_or_modules": [
        "automation/provider_router.py",
        "automation/adapters/"
      ],
      "acceptancecriteria": [
        "Provider router selects approved providers by task class",
        "Adapter pathways preserve policy and cost guard constraints"
      ],
      "definitionofdone": [
        "Provider routing integration tests pass",
        "Router decisions include auditable rationale"
      ],
      "projectplanpath": "PM_Pack/ref/project_plan/13_Cycle_013_Execution_Protocol.md",
      "filesormodules": [
        "automation/provider_router.py",
        "automation/adapters/"
      ]
    }
  ],
  "allowed_paths": [
    "docs/cycle_reports/**",
    "PM_Pack/10_cycle_log/**"
  ],
  "allowedpaths": [
    "docs/cycle_reports/**",
    "PM_Pack/10_cycle_log/**"
  ],
  "blocked_paths": [
    "src/**"
  ],
  "blockedpaths": [
    "src/**"
  ],
  "validation_commands": [
    "python automation/ai_cycle_controller.py brain-check",
    "python automation/ai_cycle_controller.py validate-prompts --cycle 080"
  ],
  "validationcommands": [
    "python automation/ai_cycle_controller.py brain-check",
    "python automation/ai_cycle_controller.py validate-prompts --cycle 080"
  ],
  "final_report_path": "docs/cycle_reports/CYCLE_080_AGENT_C.md",
  "finalreportpath": "docs/cycle_reports/CYCLE_080_AGENT_C.md",
  "built_at": "2026-06-15T15:40:19.509725+00:00",
  "builtat": "2026-06-15T15:40:19.509725+00:00",
  "contract_version": "1.0.0",
  "contractversion": "1.0.0",
  "metadata": {
    "sources_used": [
      "PM_Pack/automation/project_plan_catalog.json",
      "PM_Pack/automation/dod_catalog.json",
      "PM_Pack/automation/todo_epic_catalog.json",
      "PM_Pack/automation/github_governance_catalog.json",
      "PM_Pack/automation/agent_lanes.yml",
      "SCRUM-265"
    ],
    "sourcesused": [
      "PM_Pack/automation/project_plan_catalog.json",
      "PM_Pack/automation/dod_catalog.json",
      "PM_Pack/automation/todo_epic_catalog.json",
      "PM_Pack/automation/github_governance_catalog.json",
      "PM_Pack/automation/agent_lanes.yml",
      "SCRUM-265"
    ],
    "catalog_counts": {
      "project_plan": 96,
      "dod": 10,
      "todo": 11,
      "github": 47
    }
  }
}
