{
  "cycle": "080",
  "agent": "B",
  "agent_lane": "Backend / Data / Provider Router",
  "branch": "cycle/080/integration",
  "model_policy": {
    "worker": "Cursor CLI",
    "model": "codex-5.3",
    "effort": "medium",
    "auto": false,
    "fallback": false
  },
  "jira_scope": [
    {
      "key": "SCRUM-258",
      "summary": "Provider task classifier implementation",
      "acceptance_criteria": [
        "Classifies all known task types correctly"
      ],
      "definition_of_done": [
        "Module importable"
      ],
      "project_plan_path": "PM_Pack/ref/cycle080/provider_router.md",
      "files_or_modules": [
        "automation/provider_task_classifier.py"
      ]
    }
  ]
}
